{
  "schema_version": 1,
  "effective_date": "2026-06-19",
  "source_sha256": "e99cd70eb64ca854acb6420ebbf06e369e3f258e0cfba4f03f70bd881386f79b",
  "family": "CR 514 — Cleanup Step",
  "cases": [
    {
      "rule_id": "514",
      "rule_text_sha256": "326475478c2e9d91e69f833c6da820a552d5a1bfc7f07dff31cb56c748f75461",
      "classification": "definition_only",
      "status": "definition_only",
      "assertion_kind": "static_traceability",
      "reviewed": true,
      "implementation_components": ["mechanics/contracts/cleanup-step.json"],
      "executable_test_ids": ["tests.test_cleanup_step_rules.CleanupStepRuleTests.test_contract_traces_every_cr_514_rule"],
      "required_scenarios": [],
      "covered_scenarios": [],
      "blockers": [],
      "notes": ["Section heading; every numbered CR 514 record is pinned by the Cleanup Step contract."]
    },
    {
      "rule_id": "514.1",
      "rule_text_sha256": "90d0d0508819227cf7469bb5cbf8f8fdedcf17eaf600fb5764e7af5092b37a1e",
      "classification": "behavioral",
      "status": "passing",
      "assertion_kind": "executable_engine",
      "reviewed": true,
      "implementation_components": ["CommanderEngine._enter_step", "CommanderEngine._complete_cleanup_discard", "CommanderEngine._move_cards_simultaneously"],
      "executable_test_ids": ["tests.test_cleanup_step_rules.CleanupStepRuleTests.test_cleanup_discard_is_exact_simultaneous_private_and_replayable", "tests.test_cleanup_step_rules.CleanupStepRuleTests.test_invalid_cleanup_discard_rolls_back_capability_and_state"],
      "required_scenarios": ["positive", "negative", "hidden_information", "replay"],
      "covered_scenarios": ["positive", "negative", "hidden_information", "replay"],
      "blockers": [],
      "notes": ["The active player privately selects exactly the current excess; those cards move simultaneously without using the stack, invalid submissions roll back, and exact command replay passes."]
    },
    {
      "rule_id": "514.2",
      "rule_text_sha256": "91680059f1c98c9427c73910e1749a3ce5bef0b1192e48eb4d37cadb4c480616",
      "classification": "behavioral",
      "status": "blocked",
      "assertion_kind": "unsupported_fail_closed",
      "reviewed": true,
      "implementation_components": ["CommanderEngine._finish_cleanup", "CommanderEngine._effective_card_data", "continuous_effects"],
      "executable_test_ids": ["tests.test_cleanup_step_rules.CleanupStepRuleTests.test_cleanup_clears_damage_and_represented_turn_effects_together", "tests.test_state_based_actions.StateBasedActionEngineTests.test_marked_damage_survives_type_loss_until_cleanup", "tests.test_exact_deck_interactions.ExactDeckInteractionFamilyTests.test_liquimetal_torque_changes_only_nonland_permanents_until_cleanup"],
      "required_scenarios": ["positive", "negative", "interaction", "multiplayer", "replay"],
      "covered_scenarios": ["positive", "interaction"],
      "blockers": ["all until-end-of-turn and this-turn effects do not share one complete duration registry", "represented expirations mutate objects sequentially rather than as one universal simultaneous layer event", "replacement, trigger, multiplayer, and replay coverage is incomplete"],
      "notes": ["Marked damage, deathtouch damage, temporary keywords, selected copy/control/stat/type effects, and selected player flags expire, including on phased-out permanents, but this is not full CR 514.2 coverage."]
    },
    {
      "rule_id": "514.3",
      "rule_text_sha256": "75c95abac30fd64af208ef46d172f86016803de1dbb188e1759e7efb9a1118d0",
      "classification": "behavioral",
      "status": "passing",
      "assertion_kind": "executable_engine",
      "reviewed": true,
      "implementation_components": ["CommanderEngine._finish_cleanup", "CommanderEngine._grant_priority"],
      "executable_test_ids": ["tests.test_cleanup_step_rules.CleanupStepRuleTests.test_ordinary_cleanup_grants_no_priority", "tests.test_cleanup_step_rules.CleanupStepRuleTests.test_cleanup_state_action_grants_priority_then_repeats_cleanup"],
      "required_scenarios": ["positive", "interaction"],
      "covered_scenarios": ["positive", "interaction"],
      "blockers": [],
      "notes": ["A stable cleanup advances directly to the next turn without a cleanup priority window; only the explicit CR 514.3a frame grants priority."]
    },
    {
      "rule_id": "514.3a",
      "rule_text_sha256": "c9ab2d501b64d3181fda4e9b22f83f642395a2ecb6151038d3174acbc2db7b8f",
      "classification": "behavioral",
      "status": "blocked",
      "assertion_kind": "unsupported_fail_closed",
      "reviewed": true,
      "implementation_components": ["CommanderEngine._finish_cleanup", "CommanderEngine._active_cleanup_frame", "CommanderEngine._grant_priority", "CommanderEngine._advance_step", "CommanderEngine._stabilize"],
      "executable_test_ids": ["tests.test_cleanup_step_rules.CleanupStepRuleTests.test_cleanup_state_action_grants_priority_then_repeats_cleanup", "tests.test_cleanup_step_rules.CleanupStepRuleTests.test_next_cleanup_trigger_waits_until_cleanup_actions_finish"],
      "required_scenarios": ["positive", "negative", "interaction", "multiplayer", "hidden_information", "replay"],
      "covered_scenarios": ["positive", "interaction"],
      "blockers": ["the state-based-action and trigger subsystems do not cover every rules and Oracle family", "all simultaneous cleanup-begin, discard, expiration, and state-action triggers are not merged into one universal APNAP ordering batch", "complete target, optional-choice, hidden-information, multiplayer, and replay coverage is absent"],
      "notes": ["Represented state actions occur before priority, represented next-cleanup delayed triggers are stacked after cleanup actions, and an empty-stack pass cycle starts another cleanup step. The broad rule remains blocked by incomplete dependencies."]
    }
  ]
}
