{
  "schema_version": 1,
  "effective_date": "2026-06-19",
  "source_sha256": "e99cd70eb64ca854acb6420ebbf06e369e3f258e0cfba4f03f70bd881386f79b",
  "family": "CR 404 — Graveyard",
  "cases": [
    {
      "rule_id": "404",
      "rule_text_sha256": "3561a4b89ed11c9871f20e3597048d2c42c16d08f79492748d66e982177ee410",
      "classification": "definition_only",
      "status": "definition_only",
      "assertion_kind": "static_traceability",
      "reviewed": true,
      "implementation_components": [
        "mechanics/contracts/graveyard.json"
      ],
      "executable_test_ids": [
        "tests.test_graveyard_rules.GraveyardRuleTests.test_contract_traces_every_cr_404_rule"
      ],
      "required_scenarios": [],
      "covered_scenarios": [],
      "blockers": [],
      "notes": [
        "Section heading; CR 404.1-3 carry graveyard ownership, ordinary destinations, public ordered-pile, and simultaneous owner-ordering requirements."
      ]
    },
    {
      "rule_id": "404.1",
      "rule_text_sha256": "24af12ea059cecaca3d75c35c61d634d5a445f5bca7eaf4ac6d928bf07441202",
      "classification": "behavioral",
      "status": "passing",
      "assertion_kind": "executable_engine",
      "reviewed": true,
      "implementation_components": [
        "PlayerState.zones",
        "CommanderEngine.move_card",
        "CommanderEngine.apply_effect",
        "CommanderEngine._counter_stack_item",
        "CommanderEngine._begin_resolve_item",
        "semantic_runtime.zone_replacements.prepare_zone_change_replacement",
        "CommanderEngine._assert_invariants"
      ],
      "executable_test_ids": [
        "tests.test_graveyard_rules.GraveyardRuleTests.test_graveyards_start_empty_and_common_causes_use_owner_top",
        "tests.test_graveyard_rules.GraveyardRuleTests.test_rules_countered_permanent_spell_uses_graveyard_not_resolution_destination",
        "tests.test_graveyard_rules.GraveyardRuleTests.test_graveyard_owner_index_is_an_authoritative_invariant",
        "tests.test_graveyard_rules.GraveyardRuleTests.test_graveyard_replacement_is_decided_before_the_move",
        "tests.test_copy_objects.CopyObjectLifecycleTests.test_countered_spell_copy_reaches_graveyard_then_ceases",
        "tests.test_targeting_v070.ExactTargetingTests.test_an_offer_empty_stack_and_treasure_resolution"
      ],
      "required_scenarios": [
        "positive",
        "negative",
        "interaction",
        "multiplayer",
        "replay"
      ],
      "covered_scenarios": [
        "positive",
        "negative",
        "interaction",
        "multiplayer",
        "replay"
      ],
      "blockers": [],
      "notes": [
        "Every player begins with an empty graveyard. Generic destroy, discard, sacrifice, counter, and completed instant-or-sorcery paths append to the owner's graveyard, including when the owner did not control the permanent. Rules-countering a permanent spell now uses graveyard rather than its normal battlefield resolution destination. The exact Dauthi replacement is evaluated before insertion, and a copied spell reaches graveyard before its separately reviewed cease-to-exist state action."
      ]
    },
    {
      "rule_id": "404.2",
      "rule_text_sha256": "a77c444addca4a3172aeaea822783153636b0aaefe9c9d080f4affd78be040d9",
      "classification": "structural",
      "status": "passing",
      "assertion_kind": "executable_engine",
      "reviewed": true,
      "implementation_components": [
        "PlayerState.zones",
        "CommanderEngine.move_card",
        "StateProjector._card_visible",
        "StateProjector._zone",
        "StateProjector._snapshot"
      ],
      "executable_test_ids": [
        "tests.test_graveyard_rules.GraveyardRuleTests.test_graveyard_is_face_up_public_ordered_and_not_reordered_by_same_zone_move",
        "tests.test_zone_general_rules.ZoneGeneralRuleTests.test_same_graveyard_move_is_a_no_op",
        "tests.test_battlefield_rules.BattlefieldRuleTests.test_unqualified_effect_and_target_scope_default_to_battlefield"
      ],
      "required_scenarios": [
        "positive",
        "negative",
        "interaction",
        "multiplayer",
        "hidden_information"
      ],
      "covered_scenarios": [
        "positive",
        "negative",
        "interaction",
        "multiplayer",
        "hidden_information"
      ],
      "blockers": [],
      "notes": [
        "The authoritative list is one ordered pile per owner, with the last element as the top. Projection preserves that order and exposes every face-up identity to every seat. Entry clears face-down status and marks the identity public. Moving a card to the same graveyard is a state-preserving no-op. The engine conservatively provides no ordinary graveyard-reorder action; sanctioned-tournament exceptions remain policy outside this rules engine."
      ]
    },
    {
      "rule_id": "404.3",
      "rule_text_sha256": "c13e78b640d4e60d606dc8c5c2d25f10194cfc464d87d28c9e81aa390f17e7d1",
      "classification": "behavioral",
      "status": "blocked",
      "assertion_kind": "unsupported_fail_closed",
      "reviewed": true,
      "implementation_components": [
        "CommanderEngine._move_cards_simultaneously",
        "CommanderEngine.move_card",
        "DecisionGroup",
        "PermissionManager"
      ],
      "executable_test_ids": [
        "tests.test_graveyard_rules.GraveyardRuleTests.test_simultaneous_same_owner_order_is_still_caller_determined"
      ],
      "required_scenarios": [
        "positive",
        "negative",
        "interaction",
        "multiplayer",
        "replay"
      ],
      "covered_scenarios": [
        "negative"
      ],
      "blockers": [
        "same_owner_simultaneous_graveyard_order_choice_missing",
        "multi_owner_apnap_private_order_collection_missing",
        "generic_simultaneous_move_continuation_missing",
        "graveyard_order_choice_replay_missing"
      ],
      "notes": [
        "The simultaneous-move primitive snapshots all objects before mutation and assigns a shared timestamp, but same-owner graveyard order is currently inherited from the caller's object sequence. The characterization test proves that no owner decision is issued. Until a resumable, owner-scoped ordering choice is available across state actions and resolving effects, this rule remains blocked and the graveyard mechanic remains untrusted."
      ]
    }
  ]
}
